Bhima_River	This temple is situated off the Pune-Solapur highway about 48 km from the town of Srigonda in Ahmadnagar district. The temple is situated next to	Bhima	river. On Pune-Solapur railway, Daund Railway station is 18Km from here. [ edit ] Shri Ballaleshwar Main article: Ballaleshwar Pali Ganesha is believed to have
Bhima_River	various cities of Maharashtra throughout the year. Apart from spiritual importance, the place is best suited for enjoyment visitors. There are boating facilities offered in	River Bhima	for tourists. The surroundings are evergreen and silent for tourists to enjoy their holidays. There are 24 hours lodging services available in this place. Pandharpur
Bhima_River	which is itself formed by the Tunga River and Bhadra River that originate in the Western Ghats . Other tributaries include the Koyna River ,	Bhima River	(and its tributaries such as the Kundali River feeding into the Upper Bhima River Basin), Malaprabha River , Ghataprabha River , Yerla River , Warna
War_at_the_Warfield	the Augusta Civic Center in Augusta, Maine , on July 11, 2004 and released on the 2004 DVD Still Reigning . The band also released	War at the Warfield	and a box set, Soundtrack to the Apocalypse featuring rarities, live CD and DVD performances and various Slayer paraphernalia. From 2002 to 2004 the band
Nerdcore	for THEM that got us sent over to the USA . I've been a Washington reptile for about 4-5 years now. What drew you to	nerdcore	and how long have you been interested in the genre? One of my roommates back in boarding school used to wake me up with either
Nerdcore	For whatever reason I dug a bit deeper thinking there might be more to this and there is. Theres a music genre out there called	Nerdcore	and it rules. Hip hop artists rapping about geeky things from Star Wars to Pentium chips. Seriously, how did this genre escape me for so
Nerdcore	Friday, 22 October 2010 11:37 Written by Liz McLean Knight Monday, 24 November 2008 07:32 Nerd humor has a special place in my heart, obviously.	Nerdcore Hiphop	is a definite phenomenon thats not just a web-based onecheck out a Halloween Nerdcore Compilation by Rhymetorrents , MC Frontalot , MC Plus+ , and
Nerdcore	Friday, February 16, 2007 MC Lars sure is Hyphy for a white kid Posted by El Keter ben Tzadik Berkley, California based proponent of the	Nerdcore	sub-genre Lo-fi Post-Punk Laptop-Rap, MC Lars has been a favorite here at Imageyenation since we heard his 'Laptop EP' a few years back. We had
Nerdcore	from Glitched, the first Nerdcore event in Amsterdam. Posted on February 27, 2009 - 1 Comment Last night I was introduced to the phenomenon of	nerdcore	. Yes, Ive been often labeled a nerd and me and my friends often spend evenings just geeking out so this sounded like the perfect
Nerdcore	from their new album, Imaginary Friends . MC Frontalot , friend of Jick (KoL creator), and his friends have pretty much defined the genre of	Nerdcore	hip hop. These guys poke fun at niche issues from MMO strategy to world issues to stereotypes. Like the minibosses, his music is downloadable. Meowmeowbots
Nerdcore	full-time rapper. Pretty awesome, right? He goes by the stage name Adam WarRock and has developed quite a following among comic fans through his 	nerdcore	 rap. From being featured alongside mainstream rappers on iTunes hip hop and rap genre frontpage to contributing to FakeAPStylebook , which has turned into
Nerdcore	' Give Me A Reason ' 7. MC Frontalot -- Zero Day . What the hell? A rap album on this list? Well, it's '	nerdcore	', but hey, rap is rap. I regularly read Penny Arcade , and Frontalot was mentioned there a few years ago (as he plays their
Nerdcore	GLITCHED - The Dutch Nerdcore Event * New to Nerdcore? About Nerdcore Hip Hop	Nerdcore	is a subgenre of hip hop music characterized by themes and subjects considered to be nerdy. In the past geeks and nerds were the exception
Nerdcore	good. Case in point: This video, by the Canadian group 64K, is part of a disturbing trend. Some refer to this new musical genre as	Nerdcore	or Geeksta rap, but you need not invent new terminology when old terms like "weak" and "crap" still work just fine. White people rapping about
Nerdcore	grad-student blog, I found a post about MC Frontalot's Rhyme of the Nibelung , a hiphop track about Wagner's Ring. This is an example of	nerdcore	hiphop, the existence of which I could have predicted but was not actually aware. I encourage you to listen to more of MC Frontalot's oeuvre
Nerdcore	Happy Easter... mc chris is at it again @ Emo's this April 10th. Doesn't that just bring a smile to you face? Glad to see	Nerdcore	is still going strong... Have I said I hate taxes... this shit is getting complicated... 1040... 8606... 1065... WTF?!? More info : Chris Ward IV
Nerdcore	has been "Finnegan the Folk Hero of HTML." posted by BigLankyBastard at 6:18 AM on May 12, 2006 I'm not sure if one of the	nerdcore	artists has a song about programming, but I think chances are good. Have a look at MC Lars , MC Chris or MC Frontalot .
Nerdcore	Hawking, a group that makes music using the same program used by Stephen Hawking. If that isnt your bag, perhaps man who dubbed the term	Nerdcore	might be of use. MC Frontalot has been on the scene for over nine years with nineteen world tours. If Front isnt your cup o
Nerdcore	He's amazing on the computer, and that is used to make music. So technically, yes. How does int eighty feel about the designation of "	nerdcore	?" Does he apply the label to his music? Indifferent? As Dual Core we just make music about whatever we feel, and if it falls
Isaac_Marks	, research in phobias and their treatment grew. The idea that social phobia was a separate entity from other phobias came from the British psychiatrist,	Isaac Marks	in the 1960s. This was accepted by the American Psychiatric Association and was first officially included in the third edition of the Diagnostic and Statistical
Isaac_Marks	sound quite coherent!) where I mainly discuss why I think the concept of internet addiction is nonsense. The other guests are Dr Nick Titov ,	Prof Isaac Marks	and Dr Stephanie Bauer, who discuss their pioneering work on using computer technology to provide treatment for mental illness. Isaac Marks is one of the
Isaac_Marks	They would usually be trained in one specific kind of medicine, or in treating just the conditions they were likely to encounter among their communities.	Isaac Marks	conceived a similar idea in the field of psychotherapy, and used the term 'Barefoot Therapist' to describe it. As doctors and psychologists were both scarce
Peter_Morrissey	conducting a full, thorough and fair investigation in this matter, and will not hesitate to take appropriate action should any additional information come to light,	Peter Morrissey	, the agencys assistant director, said in a statement. At the same time, there are signs of a widening scope of a congressional review that
Peter_Morrissey	influence on designs which coincided with a more complicated and obvious sense of national identity. The designers of the outfits for the ceremonial outfits were	Peter Morrissey	, Jenny Kee and Linda Jackson , chosen for their distinctive Australian design approach and recognisable use of Australiana. Mambo took the advice of athletes
Peter_Morrissey	Nikki Phillips (model), Jaynie Seal (TV presenter), Wayne Cooper (fashion designer), Jason Sullivan ( The Block ), Carmelo Pizzino ( Dancing with the Stars ),	Peter Morrissey	(designer), Erika Heynatz (singer), Elka Whalan (Olympic swimmer).  Telstra, which is also selling the iPhone 4S on a number of plans, also sent out
Peter_Morrissey	of it as a coming-of-age piece and turning point in my work. Then there are my fashion lines that drew attention from industry heavyweights like	Peter Morrissey	and Cleo Magazine , who boldly stated, Lang Leav will change the way you dress. It is so encouraging to have this vote of confidence
Sedalia,_Colorado	1908 Up at 6 a.m., breakfast at 6:45. Started at 9:55 in 2-seated carriage, with Frank Dakan for driver. Very bright, hot morning, Reached Sedalia	Sedalia, Colorado	at 11:40. Dined at hotel and got train at 1 p.m. Left Denver Denver, Colorado at 4 p.m. and reached Boulder Boulder, Colorado on time.
Sedalia,_Colorado	Canyon, Colorado Cretaceous formations dip E about 70 (estimated from distance). Denver beds horizontal capped by lava ((later crossed out)) which has been quarried near	Sedalia	Sedalia, Colorado and castle Rock Castle Rock, Colorado on both side of the track. Reached Larkspur Larkspur,Colorado about 11:15, changed clothes in the quarters of
Sedalia,_Colorado	industry. We were honored to receive the award for Best Social Event Image for 2010 for The Sanctuary, which was taken at The Sanctuary in	Sedalia, Colorado	. We are truly grateful to have our photography recognized, and would like to thank the board members and judges for this honor.  Wish
Ben_Berger	and Minneapolis dynasty Hall of Famer George Mikan (#99) led the Lakers franchise to their first 5 NBA championships. The Lakers began in 1946 when	Ben Berger	and Morris Chalfen bought the Detroit Gems of the National Basketball League for $15,000. The team was relocated to Minneapolis in 1947. The Lakers, who
Carlos_do_Carmo	and Robbie Williams , among others. Elton John was scheduled to perform on 26 June 2009, but the show was canceled. Portuguese: Pedro Abrunhosa ,	Carlos do Carmo	, Mickael Carreira, Tony Carreira , Cl , DZRT , Da Weasel , GNR , Mariza , Rui Veloso and Xutos e Pontaps , among
Carlos_do_Carmo	fado , a unique type of fado, is also noteworthy. Internationally notable performers include Amlia Rodrigues , Carlos Paredes , Jos Afonso , Mariza ,	Carlos do Carmo	, Msia , and Madredeus . One of the most notable Portuguese musical groups outside the country, and specially in Germany , is the goth-metal
Carlos_do_Carmo	 Image via Wikipedia I basically won the Fado lottery on this Vino con Vista adventure because I was introduced to Fado by listening to	Carlos do Carmo	. Hebelted out some incredible tunes. Most of the members of his Portuguese audience in Lisbon were singing along. He is like the Frank Sinatra
Carlos_do_Carmo	nd Mariza has walked the fine line between carrying n the tradition f Amlia Rodrigues nd trying t bring n  new audience. Msia nd	Carlos d Carmo	re ls well known fado singers. Ricardo Ribeiro nd Miguel Capucho re ne f the best male fado singers f the new generation. Traditional music
Carlos_do_Carmo	stadje) om, de handen plechtig gekruist op de buik, een fado ten gehore te brengen." Have you already heard a Fado from Amalia Rodrigues ,	Carlos do Carmo	, Mariza , Cristina Branco or Dulce Pontes ? As we say in Portugal: " Silencio! Vai-se cantar o Fado !" or " Silence! Fado
Carlos_do_Carmo	starting with Lisbon fado its more suitable. There are lots of good singers/performers. Historically Amlia Rodrigues its the epitome of the female fado singer and	Carlos do Carmo	the equivalent for men (still alive and in good shape). But some younger singers as Mariza , Ktia Guerreiro, and Caman are very good. You
Carlos_do_Carmo	to the Portuguese word saudade which symbolizes the feeling of loss (a permanent, irreparable loss and its consequent life lasting damage) . Amlia Rodrigues ,	Carlos do Carmo	, Mariza , Mafalda Arnauth , and Cristina Branco are amongst the most famous individuals associated with the genre.    VictorianLondon 06 Monday
Stan_Woch	The excerpt below showcases some of Morrison and his collaborators playful approach to comics. Written by Grant Morrison, penciled by Richard Case , inked by	Stan Woch,	colored by Daniel Vozzo, and lettered by John Workman . (image copyright DC Comics) So what do you think? About these ads Like this: Like
Chinatown	tongue of lies. However, Tony later found out he was tricked, as the sword was in reality only a cheap knockoff the Devil bought in	Chinatown	. Retrieved from " http://reaper-cw.wikia.com/wiki/Sword_of_Michael?oldid=3565 " Related Categories Add category Advertisement | Your ad here Latest Photos Add a Photo 120 photos on this wiki
Chinatown	to Redlands in December 2009. [ 21 ] Some Asian-Americans live in and around the city of San Bernardino, like a late 19th century-era (gone)	Chinatown	and formerly Japanese-American area in Seccombe Park on the east end of downtown and currently, a large East-Asian community in North Loma Linda as well
Chicken_soup	search. Foods : I have barely eaten anything in the last couple of days. I have not eaten breakfast or snacks. I have only had	chicken noodle soup	and chicken and dumplings from the can. I wish I could make this myself but I had no energy. At least I have an idea
Chicken_soup	Severe Congestion . So we'll see how that works. I also picked up some hot chicken noodle soup... Ohhhh I have a bad obsession with	chicken noodle soup	. I can eat it for days in a row and not get tired of it. I love it. I eat it for dinner even
Chicken_soup	some of the DVD . My husband and kids kept me well supplied with ice, ginger ale, animal crackers, and when I got really adventurous	chicken noodle soup	. By evening I felt like the battle was pretty much over and this morning my personal slaves departed for school and I feel almost
Chicken_soup	Soup at Waffle House ! I don't know about every other Waffle House, but at 1119 in Archdale , NC, we usually just have the	Chicken Noodle	Soup... I think they may have done away with the Vegetable Beef... Posted by Matthew Apperson at 7:44 PM 0 comments Email This BlogThis! Share
Chicken_soup	SPAM , vienna sausages , chicken spread , chicken breast , albacore tuna , salmon , sardines . Soups/stews: Tomato soup , vegetable soup ,	chicken soup	, clam chowder and beef stew . Vegetables: Corn (normal and sweet ), black beans , green beans , garbanzo beans , refried beans ,
Chicken_soup	special taste for the meat when ready to cook. The methods most often used can take several days and cooked usually with garlic butter ,	chicken stock	or wine and then placed back into the shells together with the butter and sauce for serving. Additional ingredients may be added such as garlic,
Chicken_soup	sprinkled on top. Green parsley is often used as a garnish Curly Parsley Freshly chopped green parsley is used as a topping for soups like	chicken soup	, green salads or salads like Salade Olivier , on open sandwiches with cold cuts or pts . Parsley is a key ingredient in several
Chicken_soup	stated "fun fact" is that the earliest soup was made with hippopotamus bones , but fortunately today you have much tastier options . One favorite,	chicken soup	, is easy to make and really is good for you [pdf] . posted by Deathalicious (25 comments total) 15 users marked this as a
Dionysus#Parallels_with_Christianity	I just posted about -- the fact that the Jesus myth contains a multitude of plagiarisms from previous myths. People today may not be familiar	Dionysus	or Mithras , but people living back during the days of early Christianity were familiar with these other cults. "The resemblances between the two churches
Dionysus#Parallels_with_Christianity	New Testament is a cobbling together of allegorical writings by people who never met Jesus, heavily influenced by the myths of Osiris , Mithras ,	Dionysus	etc. all written at least 40 years after Jesus' supposed crucifixion. Given that we cannot even be certain of the existence of a man called
Dionysus#Parallels_with_Christianity	trace of it left in modern religion, it's in the cloven hooves and horned brow of good old Lucifer Morningstar...and maybe the Christ-like resurrection of	Dionysus	. Anyway, the guard's claim that I was desecrating a "holy religious site" is, I strongly believe, a holy load of crap. Plus you can't
Dimitri_Nanopoulos	[20] [21] [12] ErdsBacon 7), Fred Alan Wolf (Erds 5, ErdsBacon 8), and Natural Law Party Presidential Candidate John Hagelin (Erds 5 through frequent collaborator	Dimitri Nanopoulos	, ErdsBacon 8), all appearing as themselves. Hank Aaron , a baseball player, is sometimes also considered to have an ErdsBacon number of 3, as
Dimitri_Nanopoulos	scientists of modern times include Georgios Papanikolaou (inventor of the Pap test ), Nicholas Negroponte , Constantin Carathodory , Michael Dertouzos , John Argyris and	Dimitri Nanopoulos	. |} [ edit ] Symbols Flag of the Eastern Roman Empire Main articles: Flag of Greece and Double headed eagle The most widely used
type	campus development Although it's believed tht the San Jose Fault runs through campus, nd geotechnical investigations hve been conducted, there s uncertainty regarding ts precise	type	nd location. The CLA Building suffers frm structural flaws, mst notably, water intrusion. n 2005, the university filed  lawsuit against  contractor, fr whch
Taufik_Batisah	[ edit ] 2005 Rui En was chosen to perform the National Day Parade, 2005 's theme song - Reach Out For The Skies (feat.	Taufik Batisah	) and . The selection of the theme song singer each year often reflects the country's acknowledgement of her homegrown talent and is a much
Taufik_Batisah	f the 2nd season fr Singapore Idol . The 2008 countdown concert, held frm 31 December 2007 t 1 January 2008 s  same wth	Taufik Batisah	, Daren Tan Sze Wei nd Deal r N Deal babes n addition f artistes frm Channel 5 nd 8. Prior t the actual countdown
Taufik_Batisah	is most known for his smooth R&B voice and charming personality. He is the second male winner, following in the footsteps of his favourite idol,	Taufik Batisah	. 9. Joshua Ang Chengchai in Im not stupid too, cool man !  Joshua Ang Ser Kian is a Mediacorp Artiste from Singapore who
Taufik_Batisah	Suria and Central ) are transmitted from Bukit Batok. By 2011, MediaCorp's Broadcasting Centre will be relocated to Bukit Batok. The First Singapore Idol winner,	Taufik Batisah	, is currently residing in Bukit Batok with his mother and brother.  [ edit ] External links NHG Bukit Batok Polyclinic West Mall Bukit
Helen_Love	was by no means original in the pop world; both Madonna and Bananarama had employed similar outlooks. The phrase, whilst coined by Welsh indie band	Helen Love	in 1993 [ citation needed ] and was the title of an album by British pop duo Shampoo in 1995, was in fact attempted to
Simon_C._Dik	on word classes such as nouns and verbs, typically without reference beyond the individual clause. Functional Discourse Grammar (FDG), being the most recent edition of	Simon Dik	's Functional Grammar , takes a functional-typological approach to language that (i) has a top-down organization; (ii) takes acts in discourse rather than sentences as
Currency_future	that lasted centuries and centuries . T hey did eventually wise up, but so did the White folks - now they deal in finance, mostly	currency futures	accounting for 90% of the world international trade. Africa's share is the meagre 2% that however makes up the bulk of real commodity traded worldwide,
Currency_future	took a bet against the dollar and were able to sell cars at a competitive rate in the US while raking in profits on their	currency futures	). April 30  Next 
Nasser_Al-Khelaifi	Colony's controlling stake in PSG during 2011. The transfer price of the balance of Colony's shares put the club's overall value at 100m. PSG president	Nasser Al-Khelaifi	announced that he expected to invest 100m on the transfer market in the years to come to build a strong team. [ 15 ] Following
Nasser_Al-Khelaifi	Football Club Nickname(s) PSG, Paris SG, Les Rouge-et-Bleu, Les Parisiens Founded 12 August 1970 Ground Parc des Princes (capacity: 48,712) Owner Qatar Investment Authority President	Nasser Al-Khelaifi	Manager Carlo Ancelotti League Ligue 1 201112 Ligue 1, 2nd Website Club home page Home colours Away colours Third colours Current season Paris Saint-Germain Football
Wildland_fire_engine	and pinion steering , a first in work trucks. Dakotas have been used by police and fire departments, as off-road vehicles, patrol cars, or even	brush trucks	. Dodge Dakotas Local Used Car Dealer Express Auto is a Michigan Local Used Car dealer. We have been helping people with bad credit or
Wildland_fire_engine	Colorado Springs / Fire / News CSFD Deploys Wildland Fire Crew to Arizona Fires Today, Monday June 21st, the Colorado Springs Fire Department deployed a	Type III Engine	with a crew of four firefighters under to the Schultz Pass Fire burning in the Wildland-Urban Interface ( WUI ) of Flagstaff, AZ.  The
Wildland_fire_engine	debris burning, arson, careless children and mechanical equipment. The forest agency is prepared to handle these kinds of fires; its battalion of suppression vehicles includes	wildland fire engines	, fire dozers to cut fire breaks in the woods and an amphibious Marsh Master . On average, the state sees 660 wildfires each year
Wildland_fire_engine	it turned into " they also serve who only drive around." After the initial telephone and radio hook-ups, we ended up with me driving the	brush truck	, another volunteer with me (it seats two), and two more following in a private truck. The newer fire was small, way up on a
Wildland_fire_engine	the other two (the Helicopter drone and the Fighter Jet drone) are from PCC Skyburst . Stakeout Unlike Smolder, whose deco designated him as a	Fire Department Brush Truck	, Stakeout is obviously an EMS Vehicle (read: Ambulance). The red plastic on Smolder has been replaced by white plastic with painted EMS stripes and
Wildland_fire_engine	transport firefighters and pump water. Fire Chief Joe Gasparich said Monday about three-quarters of the fires his department fights are in rural areas. The new	brush truck	will be able to draw water from wells or ponds and then pump that water into tankers or other fire trucks. The vehicle it is
Franz_Ci%C3%85%C2%BEek	Vorkurs or 'preliminary course' that was the introduction to the ideas of the Bauhaus. Itten was heavily influenced in his teaching by the ideas of	Franz Ciek	and Friedrich Wilhelm August Froebel an in respect to aesthetics by the work of the Blaue Reiter group in Munich as well as the work
Liberation_Transmission	January 2010. Where We Belong is the second single from the fourth album Although the band initially wished to record a quick follow-up to 2006's	Liberation Transmission	, problems with labels and producers led to many delays. The album, titled  The Betrayed , features interludes between tracks & several of the
Liberation_Transmission	much wider scale through Columbia Records in the USA, although they remain with Visible Noise in the UK. They released Start Something in 2004, and	Liberation Transmission	in 2006. In the January 5 , 2008 edition of Kerrang! , Ian Watkins announced the following tracks for the fourth album: Its Not The
Hillclimbing	won multiple Grand Slams . Motorsport racecourses nd events were banned n Switzerland following the 1955 Le Mans disaster wth exception t events such s	Hillclimbing	. However, ths ban ws overturned n June 2007. During ths period, the country still produced successful racing drivers such s Clay Regazzoni , Sebastian
Overlay_network	7 Network neutrality controversy 8 See also 9 References 10 External links [ edit ] Architecture of P2P systems Peer-to-peer systems often implement an abstract	overlay network	, built at Application Layer , on top of the native or physical network topology. Such overlays are used for indexing and peer discovery and
Overlay_network	(actually two counter-rotating rings), but the physical topology is a star, because all neighboring connections are routed via a central physical location. Overlay network An	overlay network	is a virtual computer network that is built on top of another network. Nodes in the overlay are connected by virtual or logical links, each
Overlay_network	and 2 have been completed, mentally wrap the underlay network in a box, stick the box under your desk and forget about it! Once the	overlay network	is up and you are sending and receiving packets via the overlay, then you can worry about optimizing the underlay. My point is you can
Overlay_network	and only one VPN. Plaintext Tunnels Some virtual networks may not use encryption to protect the data contents. While VPNs often provide security, an unencrypted	overlay network	does not neatly fit within the secure or trusted categorization. For example a tunnel set up between two hosts that used Generic Routing Encapsulation (GRE)
Overlay_network	and overlay nodes. Typically, each client is able to act according to the momentary need of the network and can become part of the respective	overlay network	used to coordinate the P2P structure. This division between normal and 'better' nodes is done in order to address the scaling problems on early pure
Overlay_network	an extranet cannot consist of a single LAN; it must have at least one connection with an external network. [ edit ] Overlay network An	overlay network	is a virtual computer network that is built on top of another network. Nodes in the overlay are connected by virtual or logical links, each
Overlay_network	a peer-to-peer dynamic. In such context, social peer-to-peer processes are currently emerging throughout society . Architecture of P2P systems Peer-to-peer systems often implement an abstract	overlay network	, built at Application Layer , on top of the native or physical network topology. Such overlays are used for indexing and peer discovery and
Overlay_network	A survey taken from the perspective of content distribution is provided by ( Androutsellis-Theotokis and Spinellis 2004 ).  Structured Peer-to-Peer Architectures O The P2P	overlay network	consists of all the participating peers as network nodes. O There are links between any two nodes that know each other: i.e. if a participating
