Mule_deer	Wildlife and the Miller Creek Ranch in Meeker areoffering big-game hunters an opportunity to apply for a limited number of private property, high-quality elk and	mule deer	hunts beginning Nov. 3. Interested hunters must submit a written application by 5 p.m. Wednesday, Oct. 10, 2012 to: Colorado Parks and Wildlife  Meeker
Mule_deer	wit! I have a day to re-fit before heading to Seattle for upland bird hunting and my final stop at British Columbia for Moose ,	Mule Deer	, White Tail and Wolf with Total Outdoor Adventures so will make any adjustments then. Heres a complete rundown of the gear Im taking with
Mule_deer	Wolverine Creek Outfitters . Founded in the mid 1940s, Wolverine Creek have consistently provided hunters the opportunity to harvest trophy bull elk , moose ,	deer	and bighorn sheep . I met up with Wolverine Creek s master hunter  Ryan Lakovitch  again at this years SHOT Show . Ryan
Mule_deer	you close to the action. One (1) guide and one (1) spotter per hunter are generaly used. Top off this hunt with opportunities for trophy	Mule Deer	. (12 day hunts) Home | Hunts | Camps | News | Gallery | Links | Contact Copyright  2007 Bugle Basin Outfitters. All rights
Stealth_mode	2011-08-19 14:45:00 in the " performance " category Image by "exfordy" on Flickr End Point recently started working with a new client (a startup in	stealth mode	, cannot name names, etc.) who is using PostgreSQL because of the great success some of the people starting the company have had with Postgres
Stealth_mode	59 hours. Motion Detection  monitor your office and home and record all motion activity. Motion Capture  record video only when motion is detected.	Stealth Mode	 hide Webcam Surveyor on your computer and manage it by hot keys . Ease of Use and Compatibility. Keywords: WEBCAM SURVEYOR 2.0, WEBCAM SURVEYOR
Stealth_mode	account already, you should have received an email including contact details. If you haven't got that message, or you're not registered (and while we're in	stealth mode	) you can contact the team via twitter as @schmerg or via the blog at schmerg.com . Home About Privacy Invitations mysparebrain  2012 All
Stealth_mode	analysis / PGSI Posted by Greg Sabino Mullane Image by "exfordy" on Flickr End Point recently started working with a new client (a startup in	stealth mode	, cannot name names, etc.) who is using PostgreSQL because of the great success some of the people starting the company have had with Postgres
Stealth_mode	and the ability to scale to millions of simultaneous users. Launch with a PR blitz, including mentions in major mainstream publications. Build the product in	stealth mode	to build buzz for the eventual launch. I had the privilege, and the misfortune, to be involved with a startup that executed this plan flawlessly.
Stealth_mode	bandwidth.  http://en.wikipedia.org/wiki/Fibre_to_the_x  http://en.wikipedia.org/wiki/10-gigabit_Ethernet  http://en.wikipedia.org/wiki/XAUI  http://www.interfacebus.com/Gigabit_Ethernet_Description.html  http://en.wikipedia.org/wiki/Passive_optical_network  http://en.wikipedia.org/wiki/10G-PON  http://en.wikipedia.org/wiki/Wavelength-division_multiplexing  http://en.wikipedia.org/wiki/100_Gigabit_Ethernet   nanobiowave is future startup company (	in stealth mode	). The competition is ramping up to deliver ubiquitous access to unlimited "compute infrastructure performance", e.g. 16, 32, 64, 128, 256, 512, 1024 corecomputers, to
Stealth_mode	clinical diagnostics: http://www.ncbi.nlm.nih.gov/pubmed/22438706 A highly sensitive electrochemical biosensor based on zinc oxide nanotetrapods for L-lactic acid detection: http://www.ncbi.nlm.nih.gov/pubmed/22538963  nanobiowave is future startup company (	in stealth mode	). Example of potential "Wearable Nanobiosensors" Research and Development Supply Chain, Reference Design, and Legacy Industry & Startup Company Business Process Flow:  http://www.nano-lab.com/ <--->
Stealth_mode	credit card numbers and bank accounts are stored in encrypted form. 6. File Shredder - Delete files and folders permanently without making them restorable. 7.	Stealth Mode	- This mode will not let anyone know if you have installed Folder Lock on your system. 8. Security From Hackers - Prevent hackers to
Stealth_mode	Dashboards / Personal Command Center http://www.google.com .... Realtime Cloud Command Lines / Realtime Application Frameworks   nanobiowave systems nanobiowave is future startup company (	in stealth mode	). nanobiowave is future startup company product line architecture, enterprise architecture, and business process architecture that utilizes Telecom Network and Global CommunicationsInfrastructure, Data Centers, and
Stealth_mode	days back I decided I wanted to resolve to drink no more beer, and no more soda. I am doing this for my company -	stealth mode	. I believe my company deserves to have me in the best health possible. Image via Wikipedia I have the perfect weight for my height.
Stealth_mode	Ecosystems.Ecosystemsof Ecosystems. Expert Networks of Expert Networks. Innovation of the Innovation Business Process.   nanobiowave systems   nanobiowave is future startup company (	in stealth mode	). nanobiowave systems, a potential future startup company,is architecting extremely advanced intelligent technology platforms and application developer ecosystems to revolutionize "startup company value propositions" across
Stealth_mode	Electronic commerce , Organization , small business Monday, February 21, 2011 Got a Great Idea? Tell Everyone! Youve heard of high-tech start-ups being in 	stealth mode	, meaning theyre not telling anyone what theyre up to yet. It has a glamorous aura to it, conjuring up images of a brilliant project
Stealth_mode	etc) to implement maximum industrial automation of the healthcare industry using realtime communications access platforms and IaaS/PaaS infrastructure.  nanobiowave is future startup company (	in stealth mode	).  Example of potential "Wearable Nanobiosensors" Research and Development Supply Chain, Reference Design, and Legacy Industry & Startup Company Business Process Flow:  http://www.nano-lab.com/
Stealth_mode	Flow:  http://www.nano-lab.com/ <---> http://mc10inc.com/ <---> http://synopsys.com/home.aspx <--->  <---> http://en.wikipedia.org/wiki/GDSII and http://en.wikipedia.org/wiki/Open_Artwork_System_Interchange_Standard  <---> http://en.wikipedia.org/wiki/Fabless_manufacturing (TSMC, etc)  nanobiowave is future startup company (	in stealth mode	).  Example of Realtime Intelligence Systems: http://radar.weather.gov/Conus/index_loop.php .... Realtime Imaging / Graphics http://www.timeanddate.com/ .... Realtime Intelligence Dashboards / Personal Command Center http://www.google.com .... Realtime
Stealth_mode	for another day. PostgreSQL log analysis / PGSI Image by "exfordy" on Flickr End Point recently started working with a new client (a startup in	stealth mode	, cannot name names, etc.) who is using PostgreSQL because of the great success some of the people starting the company have had with Postgres
Stealth_mode	for nanobiowave Requirements Specification  and Detailed Functional Description for the  nanobiowave Healthcare C4ISR Systems Architecture :  nanobiowave is future startup company (	in stealth mode	).  Example of Realtime Intelligence Systems: http://radar.weather.gov/Conus/index_loop.php .... Realtime Imaging / Graphics http://www.timeanddate.com/ .... Realtime Intelligence Dashboards / Personal Command Center http://www.google.com .... Realtime
Stealth_mode	  GLOBAL ATCA DEPLOYMENT MAP  nanobiowave systems     8PSK Test at nanobiowave communications.  nanobiowave systems is a future startup	in stealth mode	, architecting extremely advanced technology IaaS, PaaS, and SaaS "hardware and software" platforms and application developer ecosystems to implement nanobiowave Sportwear with unprecedented and highly
Stealth_mode	http://www.nano-lab.com/ <---> http://mc10inc.com/ <---> http://synopsys.com/home.aspx <--->  <---> http://en.wikipedia.org/wiki/GDSII and http://en.wikipedia.org/wiki/Open_Artwork_System_Interchange_Standard  <---> http://en.wikipedia.org/wiki/Fabless_manufacturing <---> http://en.wikipedia.org/wiki/Foundry_model  <---> http://www.alltop10list.com/top-10-list-of-sports-shoe-manufacturers/ nanobiowave is future startup company (	in stealth mode	). Top 10 Contract Electronics Manufacturing Services (EMS) Companies (Ranked by Revenue): 1. Hon Hai Precision Industries 2. Flextronics 3. Jabil Circuit 4. Foxconn International
Stealth_mode	 Human Medical Biochemistry Waveform Systems Architecture   GLOBAL ATCA DEPLOYMENT MAP   nanobiowave systems   nanobiowave is future startup company (	in stealth mode	). A high revenue market sector disruptive innovation implementation of nanobiowave systems, for example, is torealize extremely advanced personal health analytics platform ecosystems and establish
Stealth_mode	 HUMAN PHYSIOLOGY: http://en.wikipedia.org/wiki/Human_physiology MEDICINE: http://en.wikipedia.org/wiki/Medicine MEDICAL SPECIALTIES: http://en.wikipedia.org/wiki/Category:Medical_specialties MEDICAL BIOCHEMISTRY: http://themedicalbiochemistrypage.org/ CLINICAL BIOCHEMISTRY: http://en.wikipedia.org/wiki/Clinical_chemistry SYSTEMS BIOLOGY: http://en.wikipedia.org/wiki/Systems_biology  nanobiowave is future startup company (	in stealth mode	)product line architecture, enterprise architecture, and business process architecture that utilizes Telecom Network and Global Communications Infrastructure, Data Centers, and Sensor Fabrics, including Wearable Nanobiosensor
Stealth_mode	, I mentioned testing out the Learn startup hypothesis by creating a niche in the t-shirt business. The great thing about this is that theres	no stealth mode	for a learn startup. Success is not defined by how awesome my idea is and how much market I can dominate. My learning is shareable
Stealth_mode	industry using realtime communications access platforms and IaaS/PaaS infrastructure.  Example of Realtime Intelligence Systems : http://radar.weather.gov/Conus/index_loop.php   nanobiowave is future startup company (	in stealth mode	). Example of potential "Wearable Nanobiosensors" Research and Development Supply Chain, Reference Design, and Legacy Industry & Startup Company Business Process Flow:   
Stealth_mode	in K-12 Science and Mathematics learning. Our software is based on decades of research in cognitive science, developmental psychology and education. We are currently in	stealth mode	while we are developing our core products and securing funding. For more information email us at "info" @ this domain .com or visit us at
Stealth_mode	Intelligence Dashboards / Personal Command Center http://www.google.com .... Realtime Cloud Command Lines / Realtime Application Frameworks  nanobiowave is a potential future startup company in	stealth mode	.  nanobiowave is an advanced Realtime Intelligence System for the Healthcare Market Sector enabling revolutionary consumer realtime home (and mobile) health analytics media center
Stealth_mode	is to fundamentally change how organizations implement and manage security in their environment. I dont quite understand what theyll offer, which I suppose explains the	stealth mode	bit. They give proper attention to the concept of attribution and TTP (tactics, techniques, and procedures), and throw out a little red meat about patriots
Stealth_mode	large beast of an enemy walking up Jobs Lane chills the top of my avoidance list. I had to go around the block again in	stealth mode	 only to catch him oozing his slime all over Main Street . He did not look good. old, gray, mad, mean, unhappy and probably
Stealth_mode	Medical Biochemistry Reader Optical and Electrochemical Nanoelectrode Array Biosensor Fabrics and associated stoichiometry equations. (nanobiowave sportswear technologies).   nanobiowave is future startup company (	in stealth mode	). nanobiowave Ventures (Venture Capital Firm) nanobiowave Capital (Private Equity Firm) nanobiowave University (Educational Institution) nanobiowave Research (Market Research Firm) nanobiowave Systems (Startup Company) nanobiowave
Stealth_mode	nomenclature , software Reactions:  Wednesday, 12 September 2012 Why our Stealth Mode isn't very stealthy... When software is developed, it is often in 	Stealth Mode	 until it's launched - that is, it's developed in secret and unveiled with a flourish on its' completion. The idea behind doing product development
Stealth_mode	/ Personal Command Center http://www.google.com .... Realtime Cloud Command Lines / Realtime Application Frameworks   nanobiowave systems  nanobiowave is future startup company (	in stealth mode	), architecting extremely advanced technology IaaS, PaaS, and SaaS "hardware and software" platforms and application developer ecosystemsto implement nanobiowave Sportwear with unprecedented and highly disruptive
Stealth_mode	popular news source , so I invited him to hear how it happened! Since leaving Mashable, Ben created The Peep Project , which is in	stealth mode	, and is an ambitious project to change the way we interact with information. Watch the FULL program Prefer audio? Great! Right click here for
Stealth_mode	PV material to positions on the substrate. Whether youre printing word documents or solar cells, acoustic printing holds promise as a high-precision low-cost solution. In	stealth mode	, Alion has not revealed much detail about the companys technology and strategy (as demonstrated by the very minimalist approach of the website), but we
Stealth_mode	.... Realtime Intelligence Dashboards / Personal Command Center http://www.google.com .... Realtime Cloud Command Lines / Realtime Application Frameworks  nanobiowave is future startup company (	in stealth mode	). Example of potential "Wearable Nanobiosensors" Research and Development Supply Chain, Reference Design, and Legacy Industry & Startup Company Business Process Flow:  http://www.nano-lab.com/ <--->
Stealth_mode	Realtime Signal Processing / Data Processing and Enterprise Infrastructure).  Example of Realtime Intelligence Systems : http://radar.weather.gov/Conus/index_loop.php   nanobiowave is future startup company (	in stealth mode	).  nanobiowave Ventures (Venture Capital Firm) nanobiowave Capital (Private Equity Firm) nanobiowave University (Educational Institution) nanobiowave Research (Market Research Firm) nanobiowave Systems (Startup Company)
Stealth_mode	rest of this trip. On Sunday I'll take a train to Wuhan, to spend a few days visiting a human genomics company still in '	stealth mode	'. You will forgive me if I don't say much more. Tuesday of the following week is Chinese New Year. I've seen the San Francisco
Stealth_mode	Sensors --- Analog/Digital --- Communications --- Network --- C4ISR Fabric/Platforms (Large Touchscreen Integrated C4ISR).   http://conceptfactory.com/   nanobiowave is future startup company (	in stealth mode	).  Example of Realtime Intelligence Systems: http://radar.weather.gov/Conus/index_loop.php .... Realtime Imaging / Graphics http://www.timeanddate.com/ .... Realtime Intelligence Dashboards / Personal Command Center http://www.google.com .... Realtime
Stealth_mode	Sensors: www.mdpi.com/1424-8220/11/6/5561/pdf http://www.ncbi.nlm.nih.gov/pmc/articles/PMC3354997/ http://www.ncbi.nlm.nih.gov/pubmed/20659855 http://www.ncbi.nlm.nih.gov/pubmed/16167686  http://www.ncbi.nlm.nih.gov/pmc/articles/PMC2864166/  http://www.linkedin.com/in/nanobiowave http://www.wtec.org/biosensing/biosensing-final.pdf http://www.prognostics.umd.edu/calcepapers/Point-of-care_Biosensor_Systems.pdf http://www.ncbi.nlm.nih.gov/pubmed/22163914 http://www.ncbi.nlm.nih.gov/pubmed/15718640 http://www.faqs.org/patents/app/20100268056 http://embc2006.njit.edu/pdf/1049_Lymberis.pdf http://www.wikid.eu/index.php/Category:Ubiquitous_technologies http://blog.ocad.ca/wordpress/gdes3b44-fw2010-01/files/2011/03/fulltext.pdf http://www.csem.ch/docs/show.aspx/10576/docname/sens3.pdf  nanobiowave is future startup company (	in stealth mode	). Example of potential "Wearable Nanobiosensors" Research and Development Supply Chain, Reference Design, and Legacy Industry & Startup Company Business Process Flow:   http://www.nano-lab.com/
Stealth_mode	something about what Ive been working on for the last year and a bit. I can be a bit secretive when a project is in	stealth mode	, so a lot of the good people I know have been kind of cut out of this particular little corner of my life and
Stealth_mode	(Startup Company) nanobiowave Communications (Communications Company) nanobiowave Human Capital (Human Capital Resources) nanobiowave Enterprise Architecture (Global Enterprise Architecture)  nanobiowave systems is a future startup	in stealth mode	, architecting extremely advanced technology IaaS, PaaS, and SaaS "hardware and software" platforms and application developer ecosystems to implement nanobiowave Sportwear with unprecedented and highly
Stealth_mode	StatsTrade Home Blog FAQ Contact Us About Us New site Jul 13 Posted by statstrade on July 13th, 2011 at 7:25 pm Free Newsletter Our	stealth mode	is fading. We have set up a new site to shareour research findings, studies and projects for the benefit of the entire community.Check out the
Stealth_mode	time Pages Home Log In Wednesday, 12 September 2012 Why our Stealth Mode isn't very stealthy... When software is developed, it is often in 	Stealth Mode	 until it's launched - that is, it's developed in secret and unveiled with a flourish on its' completion. The idea behind doing product development
Stealth_mode	to automate and totally revolutionize the healthcare market sector with a highly disruptive technology, infrastructure, and platform ecosystem.  nanobiowave systems is a future startup	in stealth mode	, architecting extremely advanced technology IaaS, PaaS, and SaaS "hardware and software" platforms and application developer ecosystems to implement nanobiowave Sportwear with unprecedented and highly
Stealth_mode	Topics for nanobiowave Requirements Specification and Detailed Functional Description for the nanobiowave Healthcare C4ISR Systems Architecture :   nanobiowave is future startup company (	in stealth mode	).  nanobiowave is an advanced Realtime Intelligence System for the Healthcare Market Sector enabling revolutionary consumer realtime home (and mobile) health analytics media center
Stealth_mode	Waveform Systems Architecture  Future Startup in Stealth Mode: nanobiowave: http://www.waveformsemiconductor.com   nanobiowave systems -- waveform semiconductor  nanobiowave is future startup company (	in stealth mode	). Example of potential "Wearable Nanobiosensors" Research and Development Supply Chain, Reference Design, and Legacy Industry & Startup Company Business Process Flow:  http://www.nano-lab.com/ <--->
Stealth_mode	Yes, but I would have to kill you if I told you. My background is in technology. Many companies in Silicon Valley operate in 	stealth mode	 while they get a few things in place. You want to have an impact when you reveal your plans and when you launch the
Stealth_mode	. Zone Alarm  if you dont have a firewall installed on your computer, you are opening yourself up to potential catastrophic security breaches. With	Stealth Mode	enabled you can search the internet in private, away from the intruding eyes of those who might want to steal your important information. As with
Antiarrhythmic_agent	completely curing the illness, it has been shown to reduce the effects by around two thirds. [ 5 ] Lidocaine is also the most important	class 1B antiarrhythmic drug	: it is used intravenously for the treatment of ventricular arrhythmias (for acute myocardial infarction , digitalis poisoning, cardioversion or cardiac catheterization ). However, a
Antiarrhythmic_agent	edit ] Rehabilitation Additional objectives are to prevent life-threatening arrhythmias or conduction disturbances. This requires monitoring in a coronary care unit and protocolised administration of	antiarrhythmic agents	. Antiarrhythmic agents are typically only given to individuals with life-threatening arrhythmias after a myocardial infarction and not to suppress the ventricular ectopy that is
Antiarrhythmic_agent	effects (see below). Its main cardiac effects are A decrease of conduction of electrical impulses through the AV node , making it a commonly used	antiarrhythmic agent	in controlling the heart rate during atrial fibrillation or atrial flutter . An increase of force of contraction via inhibition of the Na + /K
Antiarrhythmic_agent	electrophysiologists are trained in therapeutic and surgical methods to treat many of the rhythm disturbances of the heart. Therapeutic modalities employed in this field include	antiarrhythmic drug	therapy and surgical implantation of pacemakers and implantable cardioverter-defibrillators . Diagnostic testing Ambulatory electrocardiographic monitoring  Holter recording and interpretation, loop recording and interpretation; Tilt
Antiarrhythmic_agent	flecainide actually increases the chance of suffering a fatal arrhythmia. The dose may need to be adjusted in certain clinical scenarios. As with all other	antiarrhythmic agents	, there is a risk of proarrhythmia associated with the use of flecainide. This risk is probably increased when flecainide is co-administered with other class
Antiarrhythmic_agent	has. Therapies with an even less abysmal research history than homeopathy (for example, bloodletting and balancing the four humours, high dose chemotherapy for breast cancer,	antiarrhythmic agents	following a heart attack, etc) have been discarded for more promising avenues of treatment. Yet homeopathy remains due to persistent misunderstanding of the placebo effect,
Antiarrhythmic_agent	heart (producing arrhythmias) and pain signals to the brain (producing analgesia) used to create animal models of cardiac arrhythmia, which help researchers to develop new	antiarrhythmic agents	(yay!) Gutser UT et al. Mode of antinociceptive and toxic action of alkaloids of Aconitum spec.. Naunyn Schmiedebergs Arch Pharmacol. 1998 Jan;357(1):39-48. Posted by Chris
Antiarrhythmic_agent	, in 1785,which is considered the beginning of modern therapeutics.It is used to increase cardiac contractility (it is a positive inotrope ) and as an	antiarrhythmic agent	to control the heart rate, particularly in the irregular (and often fast) atrial fibrillation . Digitalis is hence often prescribed for patients in atrial fibrillation,
Antiarrhythmic_agent	in an emergency situation. Although iodide is a substrate for thyroid hormones, high levels reduce iodide organification in the thyroid gland, decreasing hormone production. The	antiarrhythmic agent	amiodarone can cause hyper- or hypothyroidism due to its high iodine content. Hypothyroidism can be caused by lithium -based mood stabilizers , usually used to
Antiarrhythmic_agent	 ke  n/ ) or lignocaine (former BAN ) (/  l  gno  ke  n/) is a common local anesthetic and	antiarrhythmic	drug. Lidocaine is used topically to relieve itching, burning and pain from skin inflammations, injected as a dental anesthetic, and in minor surgery. History Lidocaine,
Antiarrhythmic_agent	 Mol. mass 645,31 g/mol SMILES Ic1cc(cc(I)c1OCCN(CC)CC)C(=O)c2c3ccccc3oc2CCCC InChI InChI=1S/C25H29I2NO3/c1-4-7-11-22-23(18-10-8-9-12-21(18)31-22)24(29)17-15-19(26)25(20(27)16-17)30-14-13-28(5-2)6-3/h8-10,12,15-16H,4-7,11,13-14H2,1-3H3  Y Key:IYIKLHRQXLHMJQ-UHFFFAOYSA-N  Y  Y  (what is this?)  (verify) Amiodarone is an	antiarrhythmic agent	used for various types of cardiac dysrhythmias , both ventricular and atrial . It was discovered in 1961. Despite relatively common side-effects , it is
Antiarrhythmic_agent	Monitoring for arrhythmias Additional objectives are to prevent life-threatening arrhythmias or conduction disturbances. This requires monitoring in a coronary care unit and protocolised administration of	antiarrhythmic agents	. Antiarrhythmic agents are typically only given to individuals with life-threatening arrhythmias after a myocardial infarction and not to suppress the ventricular ectopy that is
Antiarrhythmic_agent	myotonia congenita  ( Thomsen disease ) or  myotonic dystrophy  ( Steinert's disease ). Tocainide Tocainide  (Tonocard) is a class Ib 	antiarrhythmic agent	. It is no longer sold in the United States . Quick look at the Pharmacokinetics Tocaine is a  lidocaine  analog, that does
Antiarrhythmic_agent	narrow Confidence Interval )." [44] Notable RCTs with unexpected results that contributed to changes in clinical practice include: After Food and Drug Administration approval, the	antiarrhythmic agents	flecainide and encainide came to market in 1986 and 1987 respectively. [45] The non-randomized studies concerning the drugs were characterized as "glowing" [46] , and
Antiarrhythmic_agent	n/ ) ( INN ), (Xylocaine) or  lignocaine  ( /lnken/ ) (former BAN ) is a common  local anesthetic  and 	antiarrhythmic	 drug. Lidocaine is used  topically  to relieve itching, burning and pain from skin inflammations, injected as a dental anesthetic or as a
Antiarrhythmic_agent	of  trigeminal neuralgia  in the event that  carbamazepine or other 1st line treatment is deemed inappropriate. It is sometimes considered a 	class 1b antiarrhythmic	. Trade names Phenytoin sodium  has been marketed as  Phenytek  by  Mylan Laboratories , previously Bertek Pharmaceuticals, and  Dilantin ;
Antiarrhythmic_agent	or lignocaine (former BAN ) (  /  l   n  k e n / ) is a common local anesthetic and	antiarrhythmic	drug. Lidocaine is used topically to relieve itching, burning and pain from skin inflammations, injected as a dental anesthetic or as a local anesthetic for
