Inca_Empire	15th century , the so called classic Quechua became an important lingua franca in ancient Peru and was adopted as the official language of the	Inca state	. This variant was the most important language used for catechism for the indigenous people during colonization. In the beginning of the 20th century ,
Inca_Empire	1790. Approximately, ths ws composed f 40,000 white landowners, 25,000 black r mulatto freedmen, nd 60,000 slaves. After ts conquest f the Aztec s nd	Incas	, Spain neglected ts Caribbean holdings. French buccaneer s settled n western Hispaniola, nd by the 1697 Treaty f Ryswick , Spain ceded the area
Inca_Empire	1 AD, several maize-based civilizations developed in the Andean region ( Santa Mara , Huarpes , Diaguitas , Sanavirones , among others). In 1480, the	Inca Empire	under the rule of emperor Pachacutec launched an offensive and conquered present-day northwestern Argentina, integrating it into a region called Collasuyu . In the northeastern
Inca_Empire	[ 1 ] . Pachamama and Inti are the most benevolent deities and are worshiped in parts of the Andean mountain ranges, also known as	Tawantinsuyu	(stretching from present day Ecuador to Chile and Argentina ). In Inca mythology , Mama Pacha or Pachamama is a fertility goddess who presides over
Inca_Empire	2009 manga) By Niki C C.M.B. Shinra Hakubutsukan no Jiken Mokuroku  Katou Motohiro/Kodansha T he Andean mountains. Former home to the Inca civilization, the	most powerful empire	in pre-Columbian America. An accident or a curse? Invited by Mou, Shinra journeys to the Andesnot to look for the fabled Inca gold, but to
Inca_Empire	2010, a Yale University representative agreed to return the artifacts to a Peruvian university. Machu Picchu was built around 1450, at the height of the	Inca Empire	.It was abandoned just over 100 years later, in 1572, as a belated result of the Spanish Conquest .It is likely that most of its
Inca_Empire	2011 by klagasse Bathed in sunshine during the day and surrounded by misty mountaintops, the magic of Machu Picchu, a pre-Columbian 15th-century ancient mega structure	Inca	site, is simply overwhelming. Commonly called as the City in the Sky and once thought the Lost City of the Incas Machu Pichuu stands 2,430
Inca_Empire	21:29, Canon Canon EOS 400D DIGIT, 5.6, 30.0mm, 0.013 sec, ISO 400 Choquequirao, or Cradle of Gold, is a partly excavated ruined city of the	Inca	in the south of Peru . Very similar in style and location to the more famous Machu Picchu, it is often referred to as its
Inca_Empire	2-12 Siege Damage 10 Siege Range 0-6 R.O.F. 1.5 / 3.0 (melee, ranged/siege) This box: view    talk    edit The	Inca	are a minor civilization in Age of Empires III . Contents 1 Overview 2 Units 3 Upgrades 3.1 Usefulness 4 In-game dialogue 5 Gallery Overview
Inca_Empire	21st century, Peruvian cuisine has become widely regarded by professionals and the international media as "the best of Latin America." Thanks to its pre-Inca and	Inca	heritage and to Spanish, Basque , African, Sino - Cantonese , Japanese and finally Italian, French and Britain immigration (mainly throughout the 19th century), Peruvian
Inca_Empire	3D Class Unreal Engine Level Sketch This is for the unreal tournament level design, and of cause my theme is inspire from the culture of	Inca empire	and the Indiana native . After my research, I decide to use the Machu Picchu as my level design basic reference. The is the floor
Inca_Empire	4,000 years of Peruvian pre-Columbian history. It boasts one of the world's largest collections of pre-Columbian art including Moche , Nazca , Chim , and	Inca	pieces. Additionally, the Larco Museum is well known for its gallery of pre-Columbian erotic pottery. It was one of the first museums in the world
Inca_Empire	500 years and traditionally includes a dance, known as Bon-Odori.   The Inti Raymi ("Festival of the Sun") was a religious ceremony of the	Inca Empire	in honor of the god Inti , one of the most venerated gods in Inca religion. According to chronicler Garcilaso de la Vega, Sapa Inca
Inca_Empire	(50mi) northwest of Cusco . Often referred to as "The Lost City of the Incas", Machu Picchu is probably the most familiar symbol of the	Inca Empire	. It was built around the year 1450, but abandoned a hundred years later, at the time of the Spanish conquest of the Inca Empire
Inca_Empire	5.Second expedition(1526) 6.The Conquest of Peru 7.Pizarros death Timeline: Maps: 1.Who was Francisco Pizarro rancisco Pizarro Gonzlez Marqus was a Spanish conquistador. Conqueror of the	Inca Empire	, and founder of Lima , currently the capital city of Peru . He was borned in Extremadura,Spain , on the year 1471 and he
Inca_Empire	; 61. Winter headache, SLUSH ; 64. Place to moor, COVE ; 65. Cloverleaf part, LOOP ; 66. Sommer on the screen, ELKE ; 68.	Quechua speaker, INCA	; 69. Pointers word, THAT ; 70. Fund-raisers giveaway, perhaps, TOTE . ----------------- Click on image to enlarge. Puzzle available on the internet at THE
Inca_Empire	70a Incans {Pachacuti's people}. Pachacuti Inca Yupanqui was the ninth Sapa Inca (1438-1471/1472) of the Kingdom of Cusco , which he transformed into the empire	Tawantinsuyu	, or the Inca Empire . In Quechua , Pachakutiq means "He who remakes the world". During his reign, Cuzco grew from a hamlet into
Inca_Empire	7:52 PM by Roberta for everyone Machu Picchu ( Quechua: Old Mountain ; sometimes called the "Lost City of the Incas") is a well-preserved pre-Columbian	Inca	ruin located on a high mountain ridge . Elevation measurements vary depending on whether the data refers to the ruin or the extremity of the
Inca_Empire	7 ] History The word 'molle' in ' Schinus molle ' comes from the Quechua word for the tree, 'molli' . [ 4 ] The	Inca	used the sweet outer part of ripe fruit to make a drink. Berries were rubbed carefully to avoid mixing with the bitter inner parts, the
Inca_Empire	[7] Potatoes were first domesticated in Peru between 3000 BC and 2000 BC. In the Altiplano , potatoes provided the principal energy source for the	Inca Empire	, its predecessors, and its Spanish successor. In Peru above 10,000 feet altitude, tubers exposed to the cold night air turned into chuo ; when
Inca_Empire	[8] Machu Picchu in Peru Machu Picchu (Spanish pronunciation: [matu pitu] , Quechua : Machu Pikchu [mtu pixtu] , "Old Peak") is a pre-Columbian 15th-century	Inca	site located 2,430 metres (7,970ft) above sea level . [1] [2] It is situated on a mountain ridge above the Urubamba Valley in Peru ,
Inca_Empire	90% of the population of certain regions of North and South America were wiped out long before direct contact with Europeans. Some cultures like the	Inca Empire	did have one big mammal domesticated, the Llama , but the Inca did not drink its milk or live in a closed space with their
Inca_Empire	a basin of about 20,600 km. The Maule river is of considerable historic interest because, among other reasons, it marked the southern limits of the	Inca Empire	. [ . . . ] Geography and ecology The region covers an area of 30,296 km and is bordered on the west by the
Inca_Empire	a bit and finally began our descent into the  navel of the world - Cusco. This beautiful city was once the capital of the	Inca Empire	with its sister capital up north in Ecuador . From the hills above, Cusco reminded me of many European cities like Florence, Italy with all
Inca_Empire	A Chakana (or Inca Cross, Chakana) is an Andean symbol. It is the three-stepped cross representing the southern cross and symbolising the three tiers of	Inca	life. The lower world, this world and the higher world. The three levels also represent the snake, puma and condor. Many buildings, temples, and religious
Inca_Empire	a comment Sacsayhuamn (also known as Saksaq Waman , Sacsahuaman or Saxahuaman ) is a walled complex near Cusco , the former capital of the	Inca	empire. The site, at an altitude of 3701 m, was added to the UNESCO World Heritage List in 1983. The Sacsahuamar Site consists of three
Inca_Empire	added works frm Central nd South America, including pieces frm the Mesoamerican Olmec , Aztec , nd Maya cultures, s well s the Moche nd	Inca	peoples f eastern South America. Asian art Highlights f the Asian art collection assembled by William nd Henry Walters include Japanese arms nd armor, Chinese
Inca_Empire	adobe.    Prior to its destruction by the Spaniards, the temple had what is believed to be the largest single roof in the	Incan Empire	, having its peak at the central wall, then stretching over the columns and some eighty two feet beyond on each side. The huge proportions
Inca_Empire	advanced they were and how they spread out from the south of Colombia down to Chile , including Ecuador , Peru and Bolivia . The	Inca Empire	was actually a collection of civilizations that were ruled by The Inca from the region of Cusco in todays Peru. What is the Sacred Valley?
Inca_Empire	ago, Ive been intrigued by this question: Why did the highly original Pre-Columbian empires of Mexico, Central and South America  the Aztecs and the	Incas	 perish so abruptly and spectacularly under European conquests, while the ancient traditions, beliefs, books and languages of the Indian subcontinent, even while suffering destructive
Inca_Empire	a great place to go to dine or simply have a drink. The second part of our journey is to see Cuzco , the old	Inca	capital, and Macchu Picchu , Urubamba with its Sacred Valley of the Incas. This is definitely going to be a once-in-a-lifetime experience. Breathtaking historic sites
Inca_Empire	a hit and before long the band was offered a recording contract . Incantation was chosen as the band's name, based on the word "	Inca	".Members of the various incarnations of the band include Tony Hinnigan ( Scottish ), Mike Taylor ( Irish ), Forbes Henderson ( English ), Simon
Inca_Empire	air encountered at high altitudes accounts for the remainder of the water loss. Lake Titicaca was perhaps the most sacred body of water to the	Inca Indians	-- numerous ruins were found on its shores and its thirty islands. The lake is also known for the artificial floating islands made of totora
Inca_Empire	albinism Published in Ying's Links Read more... Yma Sumac-Bo Mambo If you have never heard of Yma Sumac ,you are in for a treat! This	Inca	princess had an amazing voice with a vocal range of over four octaves. *If you like the song below, also check out Taki Rari .
Inca_Empire	allied wth each ther t form powerful confederations, s the Confederation f Quito. But none f these confederations culd resist the formidable momentum f the	Tawantinsuyu	. The invasion f the Inca n the 15th century ws very painful nd bloody. However, once occupied by the Quito hosts f Huayna Capac
Inca_Empire	allin , idiot , music , sunny day , very angry rant 272: What's so Good about it :) * Codex Magliabechia The Aztecs (or	Incas	, Mayans , whatever ) were a primitive, vicious and barbaric people.  They ruled their masses with fear and blood.  Prisoners were sacrificed;
Inca_Empire	all the Andes that include todays Bolivia, Peru, Ecuador and parts of Argentina, Chile and Colombia. It exists in several modern varieties, which represent the	Inca Empire	( Tawantin Suyu ) and each of its former four regions ( suyus ). source #Quechua #Bolivia #flag Loading... Hide notes 10 11 12 unboliviable
Inca_Empire	aloft in a procession to bless those present and scare away demons. The dancers take to the housetops, performing daring gymnastics, showing off their colorful	Inca	and colonial garb. At the end of the procession, war is waged on the demons, from which the faithful emerge in triumph. Finally, the gathering
Inca_Empire	Alpaca (Peru). Domesticated for thousands of years and bred specifically for their beautiful wool. Llama .Larger than alpacas andwereoriginally used as pack animals by the	Incas	. Guinea Pigs . (Equador, Peru, Bolivia). Guinea pigs were bred by indigenous South American people, such as the Incas. Theybred a variety to serve
Inca_Empire	a magnificent view of El Misti. After the monastery, we headed off to the Museum of Juanita, the Ice Maiden , and learnt more about	Inca	traditions and rituals. It was interesting, although I found some practices, such as the human sacrifice, to be quite harsh. I also saw lots of
Inca_Empire	Amazon River . Often referred to as The Lost City of the Incas , Machu Picchu is one of the most familiar symbols of the	Inca Empire	. It was built around the year 1460, but was abandoned as an official site for the Inca rulers a hundred years later, at the
Inca_Empire	America created a rather sharp cultural boundary between the settled agrarian civilizations of the west coast (which gave rise to urbanized city-states and the immense	Inca Empire	) and the semi-nomadic tribes of the east, who never developed written records or permanent monumental architecture. For this reason, very little is known about
Inca_Empire	American Civil War . [ 1 ] In 1863 Squier was appointed U. S. commissioner to Peru , where he made an exhaustive investigation of	Inca	remains and took numerous photographs of them. He later gave a series of 12 lectures on "The Inca Empire" for the Lowell Institute for their
Inca_Empire	American plants, such as tobacco and coca leaves at Ramses tomb in Egypt. The ancient civilisations of Bolivia, such as the Tiwanaku, Chiripa and the	Inca	, were known to have navigated on Lake Titicaca using reed boats. There are some theories, however, that the huge stone blocks at Tiwanaku were
Inca_Empire	American Way The cultural images of South America that dwell within most people's memories revolve around the following themes: The wealth and conquest of the	Inca empire	(especially as depicted in Peter Shaffer's 1964 drama, The Royal Hunt of the Sun ). Visions of the terraced ruins of Peru's ancient city of
Inca_Empire	Americas may not have had metal tools until the Chavn horizon (900 BCE). The Moche did have metal armor, knives and tableware. Even the metal-poor	Inca	had metal-tipped plows, at least after the conquest of Chimor . However, little archaeological research has so far been done in Peru , and nearly
Inca_Empire	America , the roads of the Inca were some of the most interesting. This network of roads converged at Cusco , the capital of the	Inca Empire	. One of them went to the city of Machu Picchu. The Incas distinguished between coastal roads and mountain roads, the former was called Camino
Inca_Empire	Among the ruins on the island are the Sacred Rock, a labyrinth-like building called Chicana, Kasa Pata, and Pilco Kaima. In the religion of the	Incas	, it was believed that the sun god was born here. Tags: isla de sol Lake Titicaca bolivia (1/75)  Next  About People I
Inca_Empire	an altitude of 2,792 meters (9,160 feet) above sea level in the district of Ollantaytambo , province of Urubamba , Cusco region . During the	Inca Empire	, Ollantaytambo was the royal estate of Emperor Pachacuti who conquered the region, built the town and a ceremonial center. At the time of the
Inca_Empire	an aperitif. The Andean variety of this bean is from the Andean Lupin ( tarwi, L. mutabilis ) and was a widespread food in the	Incan Empire	. The Andean Lupin and the Mediterranean L. albus ( White Lupin ), L. angustifolius ( Blue Lupin ), [ 3 ] and Lupinus hirsutus
Inca_Empire	ancient Meso-Americans fixed with tin or alum to make a beautiful steadfast dye (Finlay, 2002). The pigment from the Cochineal was first used by the	Inca	in frescoes (Finlay, 2002). When crushed, the blood of the Cochineal beetle is a brilliant red. Because of its non-toxicity, cochineal is still used in
Inca_Empire	and another powerful Indian chief, Comogre, who spoke of a land of great wealth on the other side of the mountains, which was probably the	Incan Empire	. Comogre offered to lead the Spaniards there in exchange for help in an Indian war. Balboa's men crossed through the densest rain forest in
Inca_Empire	and central Peru. However, their state was matched by a rising state to the south and around the year 1470AD the ruler of the Incan	Empire	, Tupac Inca Yupanqui , marched into Chan Chan and put an end to the Chimu empire and civilisation. Tupac Inca Yupanqui was the grandfather
Inca_Empire	and cultural impact of infectious disease among Native Americans, Dobyns changed the way pre-Columbus America was regarded. Mann attempts to piece together exactly how the	Inca Empire	fell, and if their population numbers far exceeded the armies of conquistadors, such as Francisco Pizarro . Heather Lechtmen explains that Europeans took metals and
Inca_Empire	and Early Years Tupac Amaru Shakur was born in the Harlem section of New York City. He was named after Tpac Amaru II , an	Incan	revolutionary who led a Peruvian uprising against Spain and subsequently received capital punishment . His mother, Afeni Shakur , was an active member of the
Inca_Empire	and evolution of some countries, triggering at least one revolution and one civil war , as well as numerous rebellions. Other Amerindians, such as the	Inca	of the Andes, the Tupinamb of Brazil, the Creek of Georgia, and the Comanche of Texas, also owned slaves. [ 3 ] Slavery was prominent
Inca_Empire	and go after it, bite for bite. So why potatoes in Peru and the rest of the world? Well, following the Spanish conquest of the	Inca Empire	(which potatoes help build and fortify), the Spanish introduced the potato to Europe in the second half of the 16th century. The staple was subsequently
Inca_Empire	and happiness, this is the basic principle of a macrobiotic diet. Macrobiotic methodology was utilized by many of the long-lived traditional cultures, such as the	Incas	, the Chinese in the Han Dynasty . Japanese philosopher and doctor George Ohsawa drew from Oriental and Japanese folk medicine to create his version
Inca_Empire	and information on Machu Picchu: Machu Picchu (Spanish pronunciation: [matu pitu] , Quechua : Machu Pikchu [mtu pixtu] , "Old Peak") is a pre-Columbian 15th-century	Inca	site located 2,430 metres (7,970ft) above sea level . [1] [2] Machu Picchu is located in the Cusco Region of Peru. It is situated on
Inca_Empire	and integrated into the Inca Empire. For a breakdown of these cultures by era, see Cultural periods of Peru . Inca Empire (14381532) Main article:	Inca Empire	Inca expansion (1438  1527 CE) The Incas created the vastest dynasty of pre-Columbian America. [6] The Tahuantinsuyowhich is derived from Quechua for The Four
Inca_Empire	and in the Postclassic period which followed. At its peak, it was one of the most densely populated and culturally dynamic societies in the world."	Inca Empire	: "The Inca Empire was the largest empire in Pre-Colombian America, and a considerably large empire in the world at its height. The administrative, political
Inca_Empire	and: It's What's For Dinner Posted by Ian Mount Today's NYT food trendspots in Buenos Aires, calling out a rise in the use of indigenous	Inca empire	ingredients like meat from the and (right), a local kind of ostrich that usually appears to be decked out in a nappy shag rug. The
Inca_Empire	and it would take some 170 years before the Spanish established substantive control over all Maya lands. Unlike the Spanish campaigns against the Aztec and	Inca Empires	, there was no single Maya political center which once overthrown would hasten the end of collective resistance from the indigenous peoples. Instead, the conquistador
Inca_Empire	and Peru in pre-Inca potteries depicting skin lesions and deformed faces dating back to the first century AD. 15th and 16th century texts from the	Inca	period and from Spanish colonials mention "valley sickness" , "Andean sickness" or "white leprosy" which are likely to be CL. Who first discovered the organism
Inca_Empire	and refuge of Manco Inca Yupanqui . Other Chan Chan  Chimu . Located near Trujillo , in present day Peru . Tiahuanaco  pre-	Inca	. Located in present day Bolivia . Cahuachi  Nazca , in present day Peru . Caral  An important center of the Norte Chico
Inca_Empire	and still inhabited by people of the Collaguas and the Cabanas cultures. The local people still maintain ancestral traditions and continue to cultivate the pre-	Inca	stepped terraces. http://www.trekker.co.il/english/peru/ Comments : Comments Off Categories : PERU Categories BOLIVIA CHILE PERU Blog at WordPress.com . Theme: Freshy by Jide . Follow Follow
Inca_Empire	and sure enough, it turned out to be Nora again. Entering Cuzco, the beauty of this city soon became obvious. In the days of the	Incas	, Cuzco was the capital of their empire. When the Spanish conquistadores captured the city, they tore down many of the Inca buildings to build
Inca_Empire	and the Yokavil (Santa Mara). Decades before facing the invasion of the Spanish colonization , the natives of these lands suffered the invasion of the	Inca Empire	. Among the most visited tourist attractions of the valley are Taf del Valle , Cafayate , Molinos , San Carlos, Santa Mara and Cachi
Inca_Empire	and was declared a World Heritage Site in 1983 by UNESCO . Cusco was the capital of the	Inca Empire	(13th century-1532). http://en.wikipedia.org/wiki/Cusco No comments posted.  2010 Francesco Dazzi - All Rights Reserved Search | Guestbook | Contact | Become a fan on Facebook
Inca_Empire	and was influenced by conquered peoples such as the Toltecs . In South America , the 14th and 15th centuries saw the rise of the	Inca	. The Inca Empire of Tawantinsuyu , with its capital at Cusco , spanned the entire Andes Mountain Range . The Inca were prosperous and
Inca_Empire	and we were into the 16th country of our now 7 month long trip. Our first destination was Cusco , the capital of the ancient	Inca	empire, and one of the oldest cities on the continent. We spent our first couple of days exploring the narrow, twisting cobbled streets and alleyways
Inca_Empire	and writer Thor Heyerdahl in his 1947 expedition across the Pacific Ocean from South America to the Polynesian islands . It was named after the	Inca	sun god, Viracocha , for whom "Kon-Tiki" was said to be an old name. Kon-Tiki is also the name of Heyerdahl 's book and the
Inca_Empire	an elaborate civilization that ended at the birth of the Capital Quito. The Caaris near Cuenca were the most advanced, and most feared by the	Inca	, due to their fierce resistance to the Incan expansion. Their architecture remains were later destroyed by Spaniards and the Incas. Approximately 96.4% of Ecuador's
Inca_Empire	an estate for the Inca emperor Pachacuti (14381472).Often referred to as the City of the Incas, it is perhaps the most familiar icon of the	Inca World	. We had it in our sights. After some time to research different tour companies we chose one which offered a good price and a
Inca_Empire	a Nikon 1 V1, 10mm Machu Picchu (Spanish pronunciation: [matu piktu] , Quechua : Machu Picchu [mtu pixtu] , "Old Peak") is a pre-Columbian 15th-century	Inca	site located 2,430 metres (7,970 ft) above sea level .Machu Picchu is located in the Cusco Region of Peru, South America . It is situated
Inca_Empire	a pattern and a grey coat with black cuffs, black liner and thin black brims around the buttonholes, fitted with buttons made from melted down	Inca	silver stolen from Spanish ships. [8] He also wore brown leather swash boots and a faded light-green bandanna. At the end of his time as
Inca_Empire	a podcast and video The fortified stone temple at Chankillo. (SAN) Recorded accounts from the 16th century A.D. detail practices of state-regulated sun worship during	Inca	times, and related social and cosmological beliefs. These speak of towers being used to mark the rising or setting position of the sun at certain
Inca_Empire	approximately 100 years later when the Spanish Conquest began. One theory is that the site was built in an area that was sacred to the	Inca	people. The Inca considered the Urubamba River to be sacred. Machu Picchu is built on a mountain which is circled almost completely by the Urubamba
Inca_Empire	a reference to his South American home country as well as legendary Bayern striker Gerd Mller , who was nicknamed "Bomber") or sometimes called "	Inca	God" by the media, started well with Bayern Munich scoring his first goal with the Bavarian team in the fourth minute of the game against
Inca_Empire	are timeless. In prehistoric times, goddesses were worshipped for their association with fertility , fecundity , and agricultural bounty. Priestesses held dominion over aspects of	Incan	, Assyrian , Babylonian , Slavonic , Roman , Greek , Proto-Indo-European , and Iroquoian religions in the millennia prior to the inception of patriarchal
Inca_Empire	Argentina. It is estimated that nearly 400,000 people speak Mapundungun at present. The Mapuches are an extremely warlike people that first resisted domination by the	Inca Empire	and later by the Spaniards. During the past five years there have been many armed clashes between Mapuches and Chilean police over ownership of large
Inca_Empire	Argentina to the south, and Chile and Peru to the west. Prior to European colonization, the Andean region of Bolivian was a part of the	Inca Empire	, which was the largest state in Pre-Columbian America . The Spanish Empire conquered the region in the 16th century. During most of the Spanish
Inca_Empire	around me after having Ready Brek for breakfast. And heres an experience that David Icke had in February 1991 on a visit to a pre-	Inca	burial ground in Peru. He writes that he felt drawn to a large mound of earth, at the top of which lay a circle of
Inca_Empire	as a portable food, often to support their armies but also for hunters and travelers. There have also been reports of tamal use in the	Inca Empire	long before the Spanish visited the new world. [ 1 ] The diversity of native languages in Mesoamerica led to a number of local words
