Constantine_the_Great	Tetrarchy . [ 13 ] Seventeen Roman Emperors were born in Serbia, second only to Italy. [ 14 ] The most famous of these was	Constantine the Great	, the first Christian Emperor, who issued religious tolerance throughout the Empire . When the Roman Empire was divided in 395, the region remained under
Constantine_the_Great	Thai Travel Dictionary Information SEO gnxe Hotels Search Friday, November 30, 2007 Colossus of Constantine The Colossus of Constantine was a colossal acrolithic statue of	Constantine the Great	(c. 280-337 AD) that once occupied the west apse of the Basilica of Maxentius in the Forum Romanum in Rome . Portions of the Colossus
Constantine_the_Great	that existed at the time.  In doing so, they forged, interpolated, mutilated, changed, and rewrote these texts for centuries.  Eusebiuss Dirty Work Besides	Constantine	, perhaps no single person had a greater hand in creating Christianity than Eusebius , who mutilated the New Testament books and works of the
Constantine_the_Great	that is designated as Church of the Italian Senate and the Roman people ( Senatus Populusque Romanus ). Relics of Saint Helena , mother of	Constantine the Great	are housed here. [10] Originally the church was Santa Maria in Capitolo , since it was on the Capitoline Hill ; by the 14th century
Constantine_the_Great	that it was he who granted York the privileges of a colonia or city. Constantius I died during his stay in York, and his son	Constantine the Great	was proclaimed Emperor by the troops based in the fortress. I'm still really impressed at the extent to which York seeks to preserve its most
Constantine_the_Great	that it will be the last generation. She accurately predicted the invasion of Hannibal 700 years before his arrival, and his defeat. She also predicted	Emperor Constantine	by name 800 years before his birth. It is also believed that she may have predicted Christ 20 years prior to his birth. 3. I
Constantine_the_Great	that our society improved lets say during the past 4000 years. Seeing that monotheistic religions played a major part in european history at least since	Constantine the Great	and that since then in all modern and powerful societies monotheism was standard you can understand my at least not entirely childish error. I connect
Constantine_the_Great	that she might be better qualified to govern the kingdom. Constantius, therefore, having made her partner of his bed, had a son by her called	Constantine	. [13] After eleven years were expired, he died at York , and bestowed the kingdom upon his son, [14] who, within a few years
Constantine_the_Great	that site was called Byzantium , a trading post town established in the 7th century BCE. It is not Christianity which distinguishes West From East.	Constantine	is also known for formally adopting the Christian religion as the official religion throughout the old Roman Empire. But the West would come under the
Constantine_the_Great	that there were two legs dividing from the upper torso. The Roman Empire eventually divided into a Western (Roman) segment and an eastern (Byzantine) segment.	Constantine the Great	"is thought of as the founder of the Eastern Roman Empire." This event is symbolized by his building an imperial residence in Byzantium, which he
Constantine_the_Great	that this stopped some British from practicing it, possibly up to the Mid-5th century. However, Christianity itself had been tolerated and not persecuted since the	emperor Constantine the Great	made it so in 313. (See: Freeman, AD 381 , 2008).Three British bishops had been present at the Council of Arles in 314. ( Eborius
Constantine_the_Great	that will be presented on this website will inspire even those who are self-proclaimed atheists.Around 300 years after the crucifixion of The Christ, Roman Emperor	Constantine	was the one who introduced Christianity as it stands to this day. Constantine claimed to have had an encounter that would be classed as a
Constantine_the_Great	the 19th.    The Emperor Aurelian was born in Moesia this day in 214 AD.    Constans , the son of	Constantine	, became emperor, at Constantinople , this day in 337 AD.    This day was celebrated as the Asclepigenia in Greece . 
Constantine_the_Great	the 31st Pope Silvester I ( 12/31/335) became the patron saint of the day. His papacy took place during the early days of Christianity under	Emperor Constantine I	(272-337). Pope Silvester I was known for endless benevolence towards the poor. He ordained that the wealthy clergy should each support a certain number of
Constantine_the_Great	the 4th and 5th century. They were governed by the ruling Merovingian dynasty of Austrasia : caring for body and soul ." 313 - Emperors	Constantine	and Licinius of the Western and Eastern Roman Empires grant religious freedom. Constantine's mother Helena (255-330) the Pious apparently found Jesus of Nazareth' crucifiction cross
Constantine_the_Great	the actual location f the city. After the 271 withdrawal f the Roman army, the city remained n the Latin influence zone, mainly becuse f	Constantine The Great	's involvement n Oltenia whch he sought t bring under Imperial rule. The importance f keeping ths zone under Rome's control ws underlined by Constantine's
Constantine_the_Great	the addition of the first pylon and the massive enclosure walls that surround the whole Precinct, both constructed by Nectanebo I . In 323 AD,	Constantine the Great	recognised the Christian religion, and in 356 ordered the closing of pagan temples throughout the empire. Karnak was by this time mostly abandoned, and Christian
Constantine_the_Great	the Arab conquest of Damascus, the mosque was built on the Christian basilica dedicated to John the Baptist since the time of the Roman emperor	Constantine I	. The mosque holds a shrine which still today contains the head of John the Baptist ( Yahya ), honored as a prophet by both
Constantine_the_Great	The Arch f Constantine s  triumphal arch n Rome , situated between the Colosseum nd the Palatine Hill . t ws erected t commemorate	Constantine I	's victory ver Maxentius t the Battle f Milvian Bridge n October 28, 312. Dedicated n 315 , t s the latest f the existing
Constantine_the_Great	the army , [14] [15] and the presence of large numbers of Christians in his army may have been a factor in the conversion of	Constantine	to Christianity. [16] [ edit ] Conversion of the Roman Empire See also: Constantine I and Christianity After the Roman Emperor
Constantine_the_Great	theatrical space framed by ionic columns nd within each s set  statue, n equestrian figure f Charlemagne by Cornacchini n the south end nd	Emperor Constantine	by Bernini (1670) n the north end. Five portals, f whch three re framed by huge salvaged antique columns, lead nt the basilica. The central
Constantine_the_Great	the behavior of moths. Also the title of a film by Guy Debord . in hoc signo vinces "by this sign you will conquer" Words	Constantine	claimed to have seen in a vision before the Battle of Milvian Bridge . in hunc effectum "for this purpose" Describes a meeting called for
Constantine_the_Great	the belief that Drepanum was her birthplace. Despite her humble birth, she married Constantius Chlorus , a Roman general in 270 and gave birth to	Constantine I	in 272. In 293, Constantius was ordered by emperor Diocletian to divorce her in order to qualify as Caesar of the Western Roman Empire, and
Constantine_the_Great	the birthday of Christ by the Church? The celebration of December 25 as Christmas was started by the Church in Rome, and officially declared by	Constantine I	, (first Christian Roman Emperor) in 314 CE, which was more than three centuries after the birth of Christ! Constantine himself was more than 40
Constantine_the_Great	. The book deals with the life of Jesus Christ , the work of the Apostles, the persecution of the Christians, the conversion of Emperor	Constantine	and how Christianity became the official religion in the Roman Empire . Eusebius died in about AD 340.   Primary Sources ^ Main Article
Constantine_the_Great	the Book of Acts (although Christianity was repressed during the reign of Emperor Nero . However, it became the official Faith/Religion of the State by	Emperor Constantine I	who himself became a Christian ): [The Commander] wrote a letter as follows: Claudius Lysias, To His Excellency, Governor Felix: Greetings. This man [Paul] was
Constantine_the_Great	The books were consulted following the Roman defeat at Placentia by the Alamanni . 312: Maxentius consulted the Sibylline Books in preparation for combat with	Constantine	, who had recently switched his allegiance from Apollo to Christ . 363: Julian the Apostate consulted the books in preparation for marching against the
Constantine_the_Great	the brief revival of paganism under his predecessor Julian. Upon arriving at Antioch, he revoked the edicts of Julian against the Christians. The Labarum of	Constantine the Great	again became the standard of the army. He issued an edict of toleration, to the effect that, while the exercise of magical rites would be
Constantine_the_Great	The building reputedly stands n the site f  pre-Christian temple. t ranks, n fact, s the frst church built n Constantinople . Roman emperor	Constantine I	commissioned the frst Hagia Irene church n the 4th century. Frm May t July 381 the First Council f Constantinople took place n the church.
Constantine_the_Great	the catacombs f the church nd t show them important relicts f the times f Herod the Great , Jesus f Nazareth , Hadrian ,	Constantine the Great	nd the Middle Ages . Former projects * Ute Wagner-Lux - Madaba / Jerusalem / Gadara , August Strobel - Kallirrho, Gunnar Lehmann; Martin Peilstcker
Constantine_the_Great	the chapel there s  chair whch ws reputed t be  seat tht ws sat n by Saint Helena , the mother f the	Emperor Constantine	when she ws looking fr the True Cross . There re tw apses n the church, ne dedicated t Saint Helena nd ne t the
Constantine_the_Great	the citizens adopted the crescent moon as their symbol [ citation needed ] . When the city became the Christian Constantinople in 330 AD ,	Constantine	also added the Virgin Mary 's star on the flag. As such, it has been claimed that when the Ottoman Turks conquered Constantinople (Istanbul) in
Constantine_the_Great	the city to worship on the Mount of Olives and sometimes on the Temple Mount itself. [ 15 ] When the empire became Christian under	Constantine I	, they were given permission to enter the city once a year, on the ninth day of the month of Av, to lament the loss
Constantine_the_Great	the clergy and demanded universal sacrifice, ordering all inhabitants to sacrifice to the gods. Persecutory laws were nullified by different emperors at different times, but	Constantine	and Licinius 's Edict of Milan (313) has traditionally marked the end of the persecution. What Diocletian failed to accomplish through persecution, Constantine succeeded through
Constantine_the_Great	the complex f palaces tht became the ancient seat f popes n the 4th century s credited t Saint Helena , mother f the Emperor	Constantine I	. In 1589, Pope Sixtus V relocated the steps t ther present location n front f the ancient palatine chapel (the Sancta Sanctorum). Ferra Fenzoni
Constantine_the_Great	The conflict between Arianism and Trinitarian beliefs was the first major doctrinal confrontation in the Church after the legalization of Christianity by the Roman Emperor	Constantine I	.  Anyhow, there are others, Paul and the Apostles were opposing those with "other gospels" shortly after the church was born.  Well forget
Constantine_the_Great	The construction of a water supply system for the city (then still called Byzantium ) had begun already under the Roman emperor Hadrian . Under	Constantine I	, when the city was rebuilt and increased in size, the system needed to be greatly expanded to meet the needs of the rapidly growing
Constantine_the_Great	the courtyard of the Palazzo dei Conservatori of the Capitoline Museums. The Colossus of Constantine was a colossal acrolithic statue of the late Roman emperor	Constantine the Great	( 280337) that once occupied the west apse of the Basilica of Maxentius near the Forum Romanum in Rome . Portions of the Colossus now
Constantine_the_Great	The Crimean War: A History ) Main entrance to the Church of the Holy Selpuchre. One of the doors was walled up by the Ottomans	Emperor Constantine	s mother, Helena, during her pilgrimage to Jerusalem, had a dream that led her to find not only the original True Cross, but the hole
Constantine_the_Great	the Danube ) and Dacia Mediterranea, Serdica became the capital of Dacia Mediterranea. The city subsequently expanded for a century and a half, which caused	Constantine the Great	to call it "my Rome". Serdica was of moderate size, but magnificent as an urban concept of planning and architecture, with abundant amusements and an
Constantine_the_Great	the Database Narrative & Analysis Visit HistoryofScience.com   back to the full timeline The Edict of Milan Proclaims "Religious Toleration" (313 CE) The Emperor	Constantine	, ruler of the Eastern parts of the Roman Empire and the Emperor Licinius , ruler of the Western parts, signed a letter known as
Constantine_the_Great	the destruction of temples along a great stretch of frontier, the main stronghold of the cult. The spread of Christianity through the Empire, boosted by	Constantine	's tolerance of it from around 310 CE, also took its toll - particularly as Christianity admitted women while Mithraism did not, which obviously limited
Constantine_the_Great	The earliest recorded mention of this connection was in a sermon of Pope Gregory . The canon of the New Testament was not selected by	Constantine	at the First Council of Nicaea . Constantine did not personally have a vote on the council, and the canon had been settled mainly by
Constantine_the_Great	the Elagabalium , the Palladium was among them. In Late Antiquity , it was rumored that the Palladium was transferred from Rome to Constantinople by	Constantine the Great	and buried under the Column of Constantine in his forum. Such a move would have undermined the primacy of Rome, and was naturally seen as
Constantine_the_Great	the emperors, a Roman general's bodyguard, also styled the praetorian guard, was employed, dating at least to the Scipio family  around 275 BC .	Constantine I	dissolved it in the 4th century. Although its name has become synonymous with intrigue, conspiracy, disloyalty and assassination, it could be argued that for the
Constantine_the_Great	the emperor. The accusation resulted in the confiscation and redistribution of his properties. The Lateran Palace fell into the hands of the emperor when Emperor	Constantine I	married his second wife Fausta , sister of Maxentius . Known by that time as the "Domus Faustae" or "House of Fausta," the Lateran Palace
Constantine_the_Great	the Empire, but they already made up approximately half the population of the Eastern provinces. (source) This may have been one of the reasons why	Constantine	decided to move the capital city of the Roman Empire from Rome to a brand new city that he built in the East called 
Constantine_the_Great	the end of the century. [ 11 ] The first Christian  Emperor of Rome was born in modern Serbia : Constantine I known as	Constantine the Great	( Naissus , 280 A.D. [ 26 ] ) and a Roman Emperor was born in Belgrade, Jovian , the restorer of Christianity , Flavius
Constantine_the_Great	the first, and the style spread during the 5th century. [ 10 ] The Church of the Holy Apostles , or Apostoleion , begun by	Constantine	in the new capital city of Constantinople , combined the congregational basilica with the centralized shrine. With a similar plan to that of the Church
Constantine_the_Great	The fort hd been established by Septimius Severus n AD 193, but following the victory ver Maxentius t the Battle f the Milvian Bridge by	Constantine I	the guard were abolished nd the fort demolished. Substantial remains f the fort lie directly beneath the basilica nave. The rest f the Basilica site
Constantine_the_Great	the founder of the Eastern Roman Empire." This event is symbolized by his building an imperial residence in Byzantium, which he renamed Constantinople. Constantinople later	became the capital	of the Eastern Roman Empire. Return to table . 63 BC-AD 476;1453: It is troublesome to identify the collapse of the Greek Empire and the
Constantine_the_Great	 The Greek army of Alexander the Great defeats Darius III of Persia in the Battle of the Granicus . 0337  Eusebius of Caesaria	Constantine the Great	dies (b. 0272). Roman emperor. 0748  Empress Gensh of Japan dies (b. 680). 1068  Emperor Go-Reizei of Japan dies (b. 1025) 1176 
Constantine_the_Great	The history of Istanbul goes back to 650 BC. It was first conquered by the Persians, then the Greeks, and then the Romans. The Roman	Emperor Constantine the Great	renamed the town after himself and it became the second capitol of Rome. Constantine was responsible for spreading Christianity throughout the Roman Empire and Constantinople
Constantine_the_Great	the ideal time to jump into the driving seat. It all started that day in July 306 when Roman troops in York hailed the young	Constantine	as emperor. Within a few years he had achieved that position in fact as well as name, and had put Christianity on the path to
Constantine_the_Great	the inability to imagine an alternative and a means to get there are hallmarks of our society. in the past, dazzling geniuses like Alexander ,	Constantine	, Martin Luther , Napoleon , Washington , and even Lenin , Mao , or Kennedy , all had visions for a greater future full
Constantine_the_Great	the institution, is ever allied with the forces of reaction? I search history in vain for evidence that it was otherwise after 326 CE when	the Emperor Constantine	bestowed the State's blessing on Christianity. Since then, which I have often seen as one of the worst things ever to happen to the church,
Constantine_the_Great	the kitchen. Indeed cloves were considered as useful as pepper, for which the Romans had a distinct liking. In the year A.D 315 the Emperor	Constantine the Great	had 150 pounds of cloves (known as caryophyllon), amongst other merchandise, sent to Rome from the spice capital Constantinople as a gift to Pope Sylvester
Constantine_the_Great	the late 18th-century sculpture representing Victory in a quadriga on the Brandenburg Gate in Berlin , Germany. Constantinople was founded by the Roman emperor 	Constantine I	on the site of an already existing city, Byzantium , settled in the early days of Greek colonial expansion, probably around 671-662 BC. The site
Constantine_the_Great	the Latin and the Ottoman Empire . It was founded in AD 330, at ancient Byzantium as the new capital of the Roman Empire by	Constantine I	, after whom it was named. The city was the largest and wealthiest European city of the Middle Ages , [ 1 ] and shared
Constantine_the_Great	the Latin crucifixio, meaning fixed to a cross, it was used mainly by the Persians, Seleucids Carthaginian and the Romans, until the year 337 when	Emperor Constantine	abolished it in the Roman Empire, this was in response for the veneration of one of its victims a certain Jesus Christ. Crucifixion was also
Constantine_the_Great	the life affirming symbols including the fish, peacock, Chi-Rho , and other pagan like symbols. They didn't use the crucifix. That changed when Roman leader	Constantine I	had a vision of the cross on the eve of battle. The vision inspired him to victory, converted him to Christianity, and with his consolidation
Constantine_the_Great	them, according to their father's will. Constantine II received Britannia, Gaul and Hispania; Constans ruled Italia, Africa, and Illyricum; and Constantius ruled the East. 	Constantine I	, in Wikipedia : The Free Encyclopedia . (Online: Wikimedia Foundation, Inc.). Retrieved from " http://www.werelate.org/wiki/Person:Constantine_I_%281%29 " Categories : Constantinus Augustus surname | Constantinus Augustus
Constantine_the_Great	them all), and I look forward to dipping into them. First, Peter Leithart of New St. Andrews College in Idaho has written a defense of	Constantine	the first Christian emperor, whose name has become, especially thanks to the work of Yoder and Hauerwas, a curse-word on the lips of many Western
Constantine_the_Great	the most beautiful cities, not just in Pamphylia, but in all of Anatolia. In the first half of the fourth century, during the reign of	Constantine the Great	(324-337), Perga became an important centre of Christianity after it had become the official religion of the Roman Empire. The city retained its status as
Constantine_the_Great	"The Most Holy Lateran Church, Mother and Mistress of all churches of the city and the World". It is the cathedral of Rome, where Emperor	Constantine	allowed the Pope to set up the episcopal chair after 312 . The first mention in ancient sources is from 313 , when a consistory
Constantine_the_Great	them t visit the city t worship n the Mount f Olives nd sometimes n the Temple Mount itself. When the empire became Christian under	Constantine I	, they were given permission t enter the city once  year, n the ninth day f the month f Av, t lament the loss
Constantine_the_Great	The next reference to it comes in the biography of a young girl named St. Nino . She had visited Jerusalem during the time of	Constantine	. Constantine (312-337 A.D.) was the first Christian to rule the Roman Empire. It was he who put an end to the religious persecution of
Constantine_the_Great	the  Noble savage . [ edit ] Christendom The growth of  Christianity  and its enhanced status in the Roman Empire after 	Constantine I	 led to the development of a distinct Christian historiography, influenced by both Christian theology and the nature of the Bible, encompassing new areas of
Constantine_the_Great	then Ravenna , and was surpassed in prestige by the Eastern capital Constantinople . Fall of the Empire and Middle Ages With the reign of	Constantine I	, the Bishop of Rome gained political as well as religious importance, eventually becoming known as the Pope and establishing Rome as the centre of
Constantine_the_Great	then they'd start to cut the army budget. When the army got weak enough, the barbarians would attack, and the entire civilization would fall. The	Emperor Constantine	realized that the Roman bureaucracy had become unmanageable so he moved the capital to Byzantium in 304 AD, leaving the bureaucrats behind. Rome collapsed in
Constantine_the_Great	the observance of them had already become an established usage in his time. There is some doubt about the genuineness of an ordinance attributed to	Constantine	, in which abstinence from public business was enforced for the seven days immediately preceding Easter Sunday, and also for the seven which followed it;
Constantine_the_Great	the Palestinian cult of Christ. Mithraism was especially important because it was a for-men-only religion , and was popular with soldiers. A few years later,	Constantine	converted to Christianity, and triggered Christianity's inexorable rise as the official religion of the world's most powerful Empire. But Constantine had emerged as Emperor after
Constantine_the_Great	the Panarion (c. 375 AD)of a certain elderly Count Joseph of Tiberias, a wealthy imperial Roman Jew who converted to Christianity in the time of	Constantine	. Count Joseph claimed that as a young man he built churches in Sepphoris and other towns that were inhabited only by Jews.Nazareth is mentioned,
Constantine_the_Great	the period covered in this book, 300 to 800AD. This colourful account by John Julius Norwich tells the story of theearly Byzantine Empire, established by	Emperor Constantine I	(Constantine theGreat) in 311 AD in the new city of Constantinople on the banks of the River Bosphorus . The NewRome.  Whilst the Pope,
Constantine_the_Great	the portion of the island of Great Britain which was controlled by the Roman Empire from AD 43 to ca. AD 410. In AD 313,	Emperor Constantine	, after converting to Christianity, issued the Edict of Milan which proclaimed religious tolerance throughout the whole empire, thus ending the persecution of the Christians.
Constantine_the_Great	the portrait began to retreat in favour of an idealised symbol of what that perso n looked like. Compare the portraits of Roman Emperors Constantine	I	and Theodosius I . Such idealisation was also to be found in the depiction of Jesus Christ  the figure most widely depicted in Western
Constantine_the_Great	the position f the Greeks n the empire nd eventually allowed them t become identified wth t altogether. The leading role f Constantinople began when	Constantine the Great	turned Byzantium nt the new capital f the Roman Empire, frm then n t be known s Constantinople , placing the city t the center
Constantine_the_Great	the power to intimidate the Senate, install new emperors, and depose ones they disliked; the last emperor they served was Maxentius , as it was	Constantine I	who disbanded them in the early 4th century and destroyed their barracks, the Castra Praetoria . [ 186 ] Augustus in an Egyptian-style depiction, a
Constantine_the_Great	The precursor to the crown was the browband called the diadem , which had been worn by the Achaemenid Persian emperors , was adopted by	Constantine I	, and was worn by all subsequent rulers of the later Roman Empire. Numerous crowns of various forms were used in Antiquity, such as the
Constantine_the_Great	The production and distribution of bibles are issues that have engaged the attention of Christian leaders for centuries. In an extant letter, dated 331, Emperor	Constantine	requested Eusebius , bishop of Caesarea , to provide him with fifty copies of the Old and New Testaments for use in the principal churches
